{
  "generated_at": "2026-04-10T12:20:18.813Z",
  "service": "template-fullstack-mono-web",
  "adapter_path": "client/web/scripts/ui-parity-app-adapter.mjs",
  "contract_path": "sdd/02_plan/10_test/templates/ui_parity_web_contract.yaml",
  "target_base_url": "http://127.0.0.1:4173",
  "default_viewport": {
    "width": 1440,
    "height": 1024
  },
  "screens": [
    {
      "id": "TWEB_001",
      "title": null,
      "route": "/",
      "tags": [],
      "status": "passed",
      "diff_ratio": 0,
      "max_diff_ratio": 0,
      "reference_image": "sdd/03_verify/10_test/ui_parity/reference/TWEB_001.png",
      "actual_image": "20260410122016/actual/TWEB_001.png",
      "diff_image": "20260410122016/diff/TWEB_001.png",
      "detail": "reference=1440x1024 actual=1440x1024 diff_pixels=0",
      "target_url": "http://127.0.0.1:4173/"
    },
    {
      "id": "TWEB_002",
      "title": null,
      "route": "/login",
      "tags": [],
      "status": "passed",
      "diff_ratio": 0,
      "max_diff_ratio": 0,
      "reference_image": "sdd/03_verify/10_test/ui_parity/reference/TWEB_002.png",
      "actual_image": "20260410122016/actual/TWEB_002.png",
      "diff_image": "20260410122016/diff/TWEB_002.png",
      "detail": "reference=1440x1024 actual=1440x1024 diff_pixels=0",
      "target_url": "http://127.0.0.1:4173/login"
    },
    {
      "id": "TWEB_003",
      "title": null,
      "route": "/signup",
      "tags": [],
      "status": "passed",
      "diff_ratio": 0,
      "max_diff_ratio": 0,
      "reference_image": "sdd/03_verify/10_test/ui_parity/reference/TWEB_003.png",
      "actual_image": "20260410122016/actual/TWEB_003.png",
      "diff_image": "20260410122016/diff/TWEB_003.png",
      "detail": "reference=1440x1024 actual=1440x1024 diff_pixels=0",
      "target_url": "http://127.0.0.1:4173/signup"
    },
    {
      "id": "TWEB_004",
      "title": null,
      "route": "/support/notices",
      "tags": [],
      "status": "passed",
      "diff_ratio": 0,
      "max_diff_ratio": 0,
      "reference_image": "sdd/03_verify/10_test/ui_parity/reference/TWEB_004.png",
      "actual_image": "20260410122016/actual/TWEB_004.png",
      "diff_image": "20260410122016/diff/TWEB_004.png",
      "detail": "reference=1440x1024 actual=1440x1024 diff_pixels=0",
      "target_url": "http://127.0.0.1:4173/support/notices"
    }
  ],
  "summary": {
    "total": 4,
    "passed": 4,
    "failed": 0,
    "missing_reference": 0,
    "capture_error": 0,
    "matched": true
  }
}
